{
  "$schema": "http://json-schema.org/draft-07/schema#",
  "type": "object",
  "required": ["defaultRoute"],
  "properties": {
    "defaultRoute": {"type": "string"},
    "requiresInitialSetup": {"type": "boolean"},
    "priority": {"type": "integer"},
    "icon": {"type": "string"},
    "color": {"type": "string"},
    "description": {"type": "string"},
    "tags": {"type": "array", "items": {"type": "string"}},
    "menu": {
      "type": "object",
      "additionalProperties": {
        "oneOf": [
          {"type": "string"},
          {"type": "object", "additionalProperties": {"type": "string"}}
        ]
      }
    }
  },
  "additionalProperties": true
}
