{
  "defaultRoute": "app_calendar_index",
  "requiresInitialSetup": false,
  "priority": 10,
  "icon": "fa-parking",
  "color": "teal",
  "description": "Optimize Customer Interactions with Advanced Support Tools.",
  "tags": ["logistics", "reservation", "mobility"],
  "menu": {
    "List": "/magazine/list_tz",
    "Calendar": {
      "List": "app_calendar_index",
      "Events": "app_event_index"
    },
    "Reservations": {
      "List of Orders": "list_order",
      "List of Shopping Carts": "list_shopping_cart"
    },
    "Parking Lots": {
      "List of Parking Lots": "/magazine/list_type/Parking",
      "List of Sections": "/section_magazine/list_for_type/Parking",
      "List of Address": "list_address"
    },
    "Pricing": {
      "List Of Products": "product_list",
      "List Of Digital Products": "list_product_digital_content",
      "List of Offers": "list_offer"
    },
    "Payments": {
      "Payments Methods": "payment_store_index",
      "Payment History": "payment_store_history_index"
    }
  }
}
